{
	"manufacturer": "Ecolink",
	"manufacturerId": "0x014a",
	"label": "DWZWAVE25",
	"description": "Z-Wave Door/Window Sensor",
	"devices": [
		{
			"productType": "0x0004",
			"productId": "0x0002"
		}
	],
	"firmwareVersion": {
		"min": "0.0",
		"max": "255.255"
	},
	"paramInformation": [
		{
			"#": "1",
			"label": "Send Basic Set",
			"description": "Send Basic Set to Association Group 2",
			"valueSize": 1,
			"minValue": 0,
			"maxValue": 255,
			"defaultValue": 0,
			"unsigned": true,
			"allowManualEntry": false,
			"options": [
				{
					"label": "Don't Send Basic Set",
					"value": 0
				},
				{
					"label": "Send Basic Set",
					"value": 255
				}
			]
		},
		{
			"#": "2",
			"label": "Send Sensor Binary Report",
			"valueSize": 1,
			"minValue": 0,
			"maxValue": 255,
			"defaultValue": 0,
			"unsigned": true,
			"allowManualEntry": false,
			"options": [
				{
					"label": "Send Sensor Binary Report",
					"value": 0
				},
				{
					"label": "Don't Send Binary Sensor Report",
					"value": 255
				}
			]
		}
	],
	"compat": {
		"forceNotificationIdleReset": true
	}
}
