{
	"manufacturer": "Zooz",
	"manufacturerId": "0x027a",
	"label": "ZEN72",
	"description": "Z-Wave Plus 700 Series Dimmer Switch",
	"devices": [
		{
			"productType": "0x7000",
			"productId": "0xa002"
		}
	],
	"firmwareVersion": {
		"min": "0.0",
		"max": "255.255"
	},
	"associations": {
		"1": {
			"label": "Lifeline",
			"maxNodes": 1,
			"isLifeline": true
		},
		"2": {
			"label": "On/Off Control",
			"maxNodes": 5
		},
		"3": {
			"label": "Dimmer Control",
			"maxNodes": 5
		}
	},
	"paramInformation": [
		{
			"#": "1",
			"$import": "~/templates/master_template.json#orientation_momentary"
		},
		{
			"#": "2",
			"$import": "~/templates/master_template.json#led_indicator_four_options"
		},
		{
			"#": "23",
			"$import": "templates/zooz_template.json#led_indicator_color"
		},
		{
			"#": "24",
			"$import": "templates/zooz_template.json#led_indicator_brightness"
		},
		{
			"#": "3",
			"$import": "templates/zooz_template.json#auto_off_timer"
		},
		{
			"#": "5",
			"$import": "templates/zooz_template.json#auto_on_timer"
		},
		{
			"#": "8",
			"$import": "~/templates/master_template.json#state_after_power_failure_off_on_prev"
		},
		{
			"#": "9",
			"$import": "templates/zooz_template.json#dimmer_ramp_rate"
		},
		{
			"#": "10",
			"$import": "templates/zooz_template.json#min_brightness"
		},
		{
			"#": "11",
			"$import": "templates/zooz_template.json#max_brightness"
		},
		{
			"#": "12",
			"$import": "templates/zooz_template.json#double_tap_up_behavior"
		},
		{
			"#": "25",
			"$import": "templates/zooz_template.json#single_tap_up_behavior"
		},
		{
			"#": "13",
			"$import": "templates/zooz_template.json#enable_scene_control"
		},
		{
			"#": "15",
			"$import": "~/templates/master_template.json#smart_switch_mode_0-2"
		},
		{
			"#": "19",
			"label": "3-Way Switch Type",
			"valueSize": 1,
			"minValue": 0,
			"maxValue": 3,
			"defaultValue": 0,
			"allowManualEntry": false,
			"options": [
				{
					"label": "Toggle switch",
					"value": 0
				},
				{
					"label": "Toggle switch (with dimming control)",
					"value": 1
				},
				{
					"label": "Momentary switch (with dimming control)",
					"value": 2
				},
				{
					"label": "Momentary switch (with dimming control, but reduce after double click)",
					"value": 3
				}
			]
		},
		{
			"#": "20",
			"label": "Smart Switch Mode: Dim Reporting Behavior",
			"valueSize": 1,
			"minValue": 0,
			"maxValue": 1,
			"defaultValue": 0,
			"allowManualEntry": false,
			"options": [
				{
					"label": "Physical disabled: Report every brightness level; Physical enabled: Report final brightness level only",
					"value": 0
				},
				{
					"label": "Report final brightness level only",
					"value": 1
				}
			]
		},
		{
			"#": "21",
			"$import": "templates/zooz_template.json#smart_switch_mode_reporting"
		},
		{
			"#": "16",
			"$import": "templates/zooz_template.json#local_dimming_speed"
		},
		{
			"#": "18",
			"$import": "templates/zooz_template.json#custom_brightness"
		},
		{
			"#": "22",
			"$import": "templates/zooz_template.json#night_light_mode"
		}
	]
}
