{
	"manufacturer": "TechniSat Digital GmbH",
	"manufacturerId": "0x0299",
	"label": "6300",
	"description": "TECHNIVISTA TV Line Software",
	"devices": [
		{
			"productType": "0x0001",
			"productId": "0x189c",
			"zwaveAllianceId": 3009
		}
	],
	"firmwareVersion": {
		"min": "0.0",
		"max": "255.255"
	},
	"metadata": {
		"reset": "Please note, if this controller is the primary controller for your network, resetting it will result in the nodes in your network being orphaned and it will be necessary after the reset to exclude and re-include all of the nodes in the network. If this controller is being used as a secondary controller in the network, use this procedure to reset this controller only in the event that the network primary controller is missing or otherwise inoperable.\n\nIn the TechniSat CONNECT app, tap the \"three horizontal lines\" icon.\nTap the \"gear\" icon button.\nIn the settings menu, select \"Smart Home\".\nFrom the \"advanced Z-Wave settings\" menu select \"Reset central unit\"",
		"manual": "https://products.z-wavealliance.org/ProductManual/File?folder=&filename=MarketCertificationFiles/3009/TS_CONNECTandSMARTHOME.pdf"
	}
}
