{
	"manufacturer": "Climax Technology, Ltd.",
	"manufacturerId": "0x018e",
	"label": "BX-35ZW",
	"description": "Bellbox",
	"devices": [
		{
			"productType": "0x0002",
			"productId": "0x0011",
			"zwaveAllianceId": 2431
		}
	],
	"firmwareVersion": {
		"min": "0.0",
		"max": "255.255"
	},
	"paramInformation": [
		{
			"#": "1",
			"label": "Alarm Length",
			"description": "1 minute to 10 minutes",
			"valueSize": 1,
			"unit": "minutes",
			"minValue": 1,
			"maxValue": 10,
			"defaultValue": 10,
			"unsigned": true
		},
		{
			"#": "2",
			"label": "Alarm LED Flash",
			"description": "0:disable, 1: enable",
			"valueSize": 1,
			"minValue": 0,
			"maxValue": 1,
			"defaultValue": 1,
			"unsigned": true
		},
		{
			"#": "3",
			"label": "Comfort Led",
			"valueSize": 1,
			"unit": "10 seconds",
			"minValue": 0,
			"maxValue": 250,
			"defaultValue": 0,
			"unsigned": true
		},
		{
			"#": "4",
			"label": "Tamper",
			"description": "0:disable, 1: enable",
			"valueSize": 1,
			"minValue": 0,
			"maxValue": 1,
			"defaultValue": 1,
			"unsigned": true
		}
	],
	"metadata": {
		"inclusion": "This product can be included and operated in any Z-Wave network with other Z-Wave certified devices from other manufactures and/or other applications. All non-battery operated nodes within the network will act as repeaters regardless of vendor to increase reliability of the network.\n -Insert the two 1.5V D-Cell alkaline batteries into the battery \n compartment connecting the correct polarity as shown on the \n battery compartment lid.The Bellbox will emit a 2-tone beep.\n -Put the Z-Wave gateway or control panel into Inclusion mode (please \n refer to the Z-Wave gateway or control panel manual).\n -Within 1.5 seconds, press the Function Button 3 times.\n -Refer to the operation manual of the Z-Wave Gateway or Control \n Panel to complete the adding process.\n -If the sensor has already been added (included) into another Z-Wave \n Gateway/Control Panel, or if the sensor is unable to be added into the \n current Z-Wave Gateway/Control Panel, please exclude it first (see \n Removing Device) before attempting to include it into the current Z-\n Wave Gateway/Control Panel.",
		"exclusion": "The Bellbox must be removed from existing Z-Wave network before being included into another. There are two methods available to exclude a device.\n -Put the Z-Wave gateway or control panel into Exclusion mode (please \n refer to the Z-Wave gateway or control panel manual).\n -Within 1.5 seconds, press the Function Button 3 times and the Bellbox \n will be removed from the Z-Wave network.",
		"reset": "(Only use factory reset when network Control Panel/Gateway is missing or inoperable).\n -Press and hold the Function button of the Bellbox for 10 seconds to \n factory reset with all LED flashes once.\n<NOTE>\n -Factory resetting the Bellbox will restore it to factory default \n settings (excluded from the Z-Wave network). The Z-Wave gateway or \n control panel will still keep its Z-Wave settings. Please refer to the \n gateway or control panel manual on how to remove the Bellboxâ€™s Z-\n Wave settings.",
		"manual": "https://products.z-wavealliance.org/ProductManual/File?folder=&filename=MarketCertificationFiles/2431/BX-35-ZW_20170508.pdf"
	}
}
